<!DOCTYPE dataset SYSTEM "dtd\test_sp_database_allFieldsOptional.dtd">
    <dataset>
        <clients id="1"/>
        <clients id="2"/>
        <sp id="1"/>
        <sp id="2"/>

        <orders id="1" client="1" sp="1"/>
        <orders id="2" client="2" sp="2"/>
        <products id="1"/>
        <products id="2"/>

        <order_position id="2" order_id="2" product_id="2"/>
    </dataset>